"DESCRIPTION","DURATION IN MS","NAME","PARENT SUITE","START TIME","STATUS","STOP TIME","SUB SUITE","SUITE","TEST CLASS","TEST METHOD"
"","273","Юзер с ошибкой: Username is required","tests","Sun May 04 00:45:05 UTC 2025","passed","Sun May 04 00:45:05 UTC 2025","","Регресс","",""
"","272","Юзер с ошибкой: Username and password do not match","tests","Sun May 04 00:45:05 UTC 2025","passed","Sun May 04 00:45:05 UTC 2025","","Регресс","",""
"","591","Успешный вход обычным юзером","tests","Sun May 04 00:45:04 UTC 2025","passed","Sun May 04 00:45:04 UTC 2025","","Регресс","",""
"","300","Юзер с ошибкой: Sorry, this user has been locked out.","tests","Sun May 04 00:45:04 UTC 2025","passed","Sun May 04 00:45:05 UTC 2025","","Регресс","",""
"","1261","Тест с ошибкой","tests","Sun May 04 00:45:07 UTC 2025","failed","Sun May 04 00:45:08 UTC 2025","","Регресс","",""
"","1244","Успешный выход обычным юзером","tests","Sun May 04 00:45:05 UTC 2025","passed","Sun May 04 00:45:07 UTC 2025","","Регресс","",""
