"DESCRIPTION","DURATION IN MS","NAME","PARENT SUITE","START TIME","STATUS","STOP TIME","SUB SUITE","SUITE","TEST CLASS","TEST METHOD"
"","302","Юзер с ошибкой: Username is required","tests","Sat Jul 12 00:44:49 UTC 2025","passed","Sat Jul 12 00:44:49 UTC 2025","","Регресс","",""
"","297","Юзер с ошибкой: Sorry, this user has been locked out.","tests","Sat Jul 12 00:44:48 UTC 2025","passed","Sat Jul 12 00:44:49 UTC 2025","","Регресс","",""
"","1214","Тест с ошибкой","tests","Sat Jul 12 00:44:51 UTC 2025","failed","Sat Jul 12 00:44:52 UTC 2025","","Регресс","",""
"","454","Успешный вход обычным юзером","tests","Sat Jul 12 00:44:48 UTC 2025","passed","Sat Jul 12 00:44:48 UTC 2025","","Регресс","",""
"","251","Юзер с ошибкой: Username and password do not match","tests","Sat Jul 12 00:44:49 UTC 2025","passed","Sat Jul 12 00:44:49 UTC 2025","","Регресс","",""
"","1237","Успешный выход обычным юзером","tests","Sat Jul 12 00:44:49 UTC 2025","passed","Sat Jul 12 00:44:51 UTC 2025","","Регресс","",""
