"DESCRIPTION","DURATION IN MS","NAME","PARENT SUITE","START TIME","STATUS","STOP TIME","SUB SUITE","SUITE","TEST CLASS","TEST METHOD"
"","1227","Успешный выход обычным юзером","tests","Sat May 03 00:39:32 UTC 2025","passed","Sat May 03 00:39:33 UTC 2025","","Регресс","",""
"","1209","Тест с ошибкой","tests","Sat May 03 00:39:33 UTC 2025","failed","Sat May 03 00:39:34 UTC 2025","","Регресс","",""
"","308","Юзер с ошибкой: Sorry, this user has been locked out.","tests","Sat May 03 00:39:31 UTC 2025","passed","Sat May 03 00:39:31 UTC 2025","","Регресс","",""
"","255","Юзер с ошибкой: Username and password do not match","tests","Sat May 03 00:39:31 UTC 2025","passed","Sat May 03 00:39:31 UTC 2025","","Регресс","",""
"","604","Успешный вход обычным юзером","tests","Sat May 03 00:39:30 UTC 2025","passed","Sat May 03 00:39:30 UTC 2025","","Регресс","",""
"","293","Юзер с ошибкой: Username is required","tests","Sat May 03 00:39:31 UTC 2025","passed","Sat May 03 00:39:31 UTC 2025","","Регресс","",""
