"DESCRIPTION","DURATION IN MS","NAME","PARENT SUITE","START TIME","STATUS","STOP TIME","SUB SUITE","SUITE","TEST CLASS","TEST METHOD"
"","286","Юзер с ошибкой: Username and password do not match","tests","Thu Jul 03 00:42:51 UTC 2025","passed","Thu Jul 03 00:42:52 UTC 2025","","Регресс","",""
"","405","Успешный вход обычным юзером","tests","Thu Jul 03 00:42:51 UTC 2025","passed","Thu Jul 03 00:42:51 UTC 2025","","Регресс","",""
"","271","Юзер с ошибкой: Username is required","tests","Thu Jul 03 00:42:52 UTC 2025","passed","Thu Jul 03 00:42:52 UTC 2025","","Регресс","",""
"","1252","Успешный выход обычным юзером","tests","Thu Jul 03 00:42:52 UTC 2025","passed","Thu Jul 03 00:42:53 UTC 2025","","Регресс","",""
"","1215","Тест с ошибкой","tests","Thu Jul 03 00:42:53 UTC 2025","failed","Thu Jul 03 00:42:54 UTC 2025","","Регресс","",""
"","293","Юзер с ошибкой: Sorry, this user has been locked out.","tests","Thu Jul 03 00:42:51 UTC 2025","passed","Thu Jul 03 00:42:51 UTC 2025","","Регресс","",""
