"DESCRIPTION","DURATION IN MS","NAME","PARENT SUITE","START TIME","STATUS","STOP TIME","SUB SUITE","SUITE","TEST CLASS","TEST METHOD"
"","416","Юзер с ошибкой: Username and password do not match","tests","Sat Jul 26 00:43:29 UTC 2025","passed","Sat Jul 26 00:43:29 UTC 2025","","Регресс","",""
"","414","Юзер с ошибкой: Sorry, this user has been locked out.","tests","Sat Jul 26 00:43:28 UTC 2025","passed","Sat Jul 26 00:43:28 UTC 2025","","Регресс","",""
"","428","Юзер с ошибкой: Username is required","tests","Sat Jul 26 00:43:29 UTC 2025","passed","Sat Jul 26 00:43:29 UTC 2025","","Регресс","",""
"","1394","Тест с ошибкой","tests","Sat Jul 26 00:43:31 UTC 2025","failed","Sat Jul 26 00:43:32 UTC 2025","","Регресс","",""
"","566","Успешный вход обычным юзером","tests","Sat Jul 26 00:43:27 UTC 2025","passed","Sat Jul 26 00:43:28 UTC 2025","","Регресс","",""
"","1384","Успешный выход обычным юзером","tests","Sat Jul 26 00:43:29 UTC 2025","passed","Sat Jul 26 00:43:31 UTC 2025","","Регресс","",""
