"DESCRIPTION","DURATION IN MS","NAME","PARENT SUITE","START TIME","STATUS","STOP TIME","SUB SUITE","SUITE","TEST CLASS","TEST METHOD"
"","260","Юзер с ошибкой: Sorry, this user has been locked out.","tests","Thu May 08 00:41:21 UTC 2025","passed","Thu May 08 00:41:21 UTC 2025","","Регресс","",""
"","512","Успешный вход обычным юзером","tests","Thu May 08 00:41:20 UTC 2025","passed","Thu May 08 00:41:21 UTC 2025","","Регресс","",""
"","249","Юзер с ошибкой: Username and password do not match","tests","Thu May 08 00:41:21 UTC 2025","passed","Thu May 08 00:41:21 UTC 2025","","Регресс","",""
"","1227","Тест с ошибкой","tests","Thu May 08 00:41:23 UTC 2025","failed","Thu May 08 00:41:24 UTC 2025","","Регресс","",""
"","1213","Успешный выход обычным юзером","tests","Thu May 08 00:41:21 UTC 2025","passed","Thu May 08 00:41:23 UTC 2025","","Регресс","",""
"","247","Юзер с ошибкой: Username is required","tests","Thu May 08 00:41:21 UTC 2025","passed","Thu May 08 00:41:21 UTC 2025","","Регресс","",""
