"DESCRIPTION","DURATION IN MS","NAME","PARENT SUITE","START TIME","STATUS","STOP TIME","SUB SUITE","SUITE","TEST CLASS","TEST METHOD"
"","1249","Тест с ошибкой","tests","Fri Aug 15 00:43:52 UTC 2025","failed","Fri Aug 15 00:43:53 UTC 2025","","Регресс","",""
"","1249","Успешный выход обычным юзером","tests","Fri Aug 15 00:43:51 UTC 2025","passed","Fri Aug 15 00:43:52 UTC 2025","","Регресс","",""
"","298","Юзер с ошибкой: Username and password do not match","tests","Fri Aug 15 00:43:50 UTC 2025","passed","Fri Aug 15 00:43:50 UTC 2025","","Регресс","",""
"","608","Успешный вход обычным юзером","tests","Fri Aug 15 00:43:49 UTC 2025","passed","Fri Aug 15 00:43:50 UTC 2025","","Регресс","",""
"","275","Юзер с ошибкой: Username is required","tests","Fri Aug 15 00:43:50 UTC 2025","passed","Fri Aug 15 00:43:51 UTC 2025","","Регресс","",""
"","306","Юзер с ошибкой: Sorry, this user has been locked out.","tests","Fri Aug 15 00:43:50 UTC 2025","passed","Fri Aug 15 00:43:50 UTC 2025","","Регресс","",""
