"DESCRIPTION","DURATION IN MS","NAME","PARENT SUITE","START TIME","STATUS","STOP TIME","SUB SUITE","SUITE","TEST CLASS","TEST METHOD"
"","285","Юзер с ошибкой: Username and password do not match","tests","Sat Jun 14 00:40:38 UTC 2025","passed","Sat Jun 14 00:40:39 UTC 2025","","Регресс","",""
"","272","Юзер с ошибкой: Username is required","tests","Sat Jun 14 00:40:39 UTC 2025","passed","Sat Jun 14 00:40:39 UTC 2025","","Регресс","",""
"","1241","Тест с ошибкой","tests","Sat Jun 14 00:40:40 UTC 2025","failed","Sat Jun 14 00:40:42 UTC 2025","","Регресс","",""
"","357","Успешный вход обычным юзером","tests","Sat Jun 14 00:40:38 UTC 2025","passed","Sat Jun 14 00:40:38 UTC 2025","","Регресс","",""
"","293","Юзер с ошибкой: Sorry, this user has been locked out.","tests","Sat Jun 14 00:40:38 UTC 2025","passed","Sat Jun 14 00:40:38 UTC 2025","","Регресс","",""
"","1229","Успешный выход обычным юзером","tests","Sat Jun 14 00:40:39 UTC 2025","passed","Sat Jun 14 00:40:40 UTC 2025","","Регресс","",""
