"DESCRIPTION","DURATION IN MS","NAME","PARENT SUITE","START TIME","STATUS","STOP TIME","SUB SUITE","SUITE","TEST CLASS","TEST METHOD"
"","1206","Успешный выход обычным юзером","tests","Sat Aug 09 00:41:56 UTC 2025","passed","Sat Aug 09 00:41:58 UTC 2025","","Регресс","",""
"","258","Юзер с ошибкой: Sorry, this user has been locked out.","tests","Sat Aug 09 00:41:55 UTC 2025","passed","Sat Aug 09 00:41:56 UTC 2025","","Регресс","",""
"","269","Юзер с ошибкой: Username and password do not match","tests","Sat Aug 09 00:41:56 UTC 2025","passed","Sat Aug 09 00:41:56 UTC 2025","","Регресс","",""
"","288","Юзер с ошибкой: Username is required","tests","Sat Aug 09 00:41:56 UTC 2025","passed","Sat Aug 09 00:41:56 UTC 2025","","Регресс","",""
"","540","Успешный вход обычным юзером","tests","Sat Aug 09 00:41:55 UTC 2025","passed","Sat Aug 09 00:41:55 UTC 2025","","Регресс","",""
"","1216","Тест с ошибкой","tests","Sat Aug 09 00:41:58 UTC 2025","failed","Sat Aug 09 00:41:59 UTC 2025","","Регресс","",""
