"DESCRIPTION","DURATION IN MS","NAME","PARENT SUITE","START TIME","STATUS","STOP TIME","SUB SUITE","SUITE","TEST CLASS","TEST METHOD"
"","284","Юзер с ошибкой: Sorry, this user has been locked out.","tests","Fri Aug 01 00:53:27 UTC 2025","passed","Fri Aug 01 00:53:27 UTC 2025","","Регресс","",""
"","1215","Тест с ошибкой","tests","Fri Aug 01 00:53:29 UTC 2025","failed","Fri Aug 01 00:53:30 UTC 2025","","Регресс","",""
"","236","Юзер с ошибкой: Username is required","tests","Fri Aug 01 00:53:28 UTC 2025","passed","Fri Aug 01 00:53:28 UTC 2025","","Регресс","",""
"","1221","Успешный выход обычным юзером","tests","Fri Aug 01 00:53:28 UTC 2025","passed","Fri Aug 01 00:53:29 UTC 2025","","Регресс","",""
"","479","Успешный вход обычным юзером","tests","Fri Aug 01 00:53:26 UTC 2025","passed","Fri Aug 01 00:53:27 UTC 2025","","Регресс","",""
"","253","Юзер с ошибкой: Username and password do not match","tests","Fri Aug 01 00:53:27 UTC 2025","passed","Fri Aug 01 00:53:28 UTC 2025","","Регресс","",""
