"DESCRIPTION","DURATION IN MS","NAME","PARENT SUITE","START TIME","STATUS","STOP TIME","SUB SUITE","SUITE","TEST CLASS","TEST METHOD"
"","270","Юзер с ошибкой: Username is required","tests","Thu Aug 21 00:39:13 UTC 2025","passed","Thu Aug 21 00:39:13 UTC 2025","","Регресс","",""
"","296","Юзер с ошибкой: Sorry, this user has been locked out.","tests","Thu Aug 21 00:39:12 UTC 2025","passed","Thu Aug 21 00:39:13 UTC 2025","","Регресс","",""
"","1248","Тест с ошибкой","tests","Thu Aug 21 00:39:15 UTC 2025","failed","Thu Aug 21 00:39:16 UTC 2025","","Регресс","",""
"","553","Успешный вход обычным юзером","tests","Thu Aug 21 00:39:12 UTC 2025","passed","Thu Aug 21 00:39:12 UTC 2025","","Регресс","",""
"","295","Юзер с ошибкой: Username and password do not match","tests","Thu Aug 21 00:39:13 UTC 2025","passed","Thu Aug 21 00:39:13 UTC 2025","","Регресс","",""
"","1250","Успешный выход обычным юзером","tests","Thu Aug 21 00:39:13 UTC 2025","passed","Thu Aug 21 00:39:15 UTC 2025","","Регресс","",""
