"DESCRIPTION","DURATION IN MS","NAME","PARENT SUITE","START TIME","STATUS","STOP TIME","SUB SUITE","SUITE","TEST CLASS","TEST METHOD"
"","269","Юзер с ошибкой: Username is required","tests","Wed May 07 00:40:52 UTC 2025","passed","Wed May 07 00:40:53 UTC 2025","","Регресс","",""
"","275","Юзер с ошибкой: Username and password do not match","tests","Wed May 07 00:40:52 UTC 2025","passed","Wed May 07 00:40:52 UTC 2025","","Регресс","",""
"","644","Успешный вход обычным юзером","tests","Wed May 07 00:40:51 UTC 2025","passed","Wed May 07 00:40:52 UTC 2025","","Регресс","",""
"","1231","Успешный выход обычным юзером","tests","Wed May 07 00:40:53 UTC 2025","passed","Wed May 07 00:40:54 UTC 2025","","Регресс","",""
"","318","Юзер с ошибкой: Sorry, this user has been locked out.","tests","Wed May 07 00:40:52 UTC 2025","passed","Wed May 07 00:40:52 UTC 2025","","Регресс","",""
"","1259","Тест с ошибкой","tests","Wed May 07 00:40:54 UTC 2025","failed","Wed May 07 00:40:55 UTC 2025","","Регресс","",""
