"DESCRIPTION","DURATION IN MS","NAME","PARENT SUITE","START TIME","STATUS","STOP TIME","SUB SUITE","SUITE","TEST CLASS","TEST METHOD"
"","287","Юзер с ошибкой: Sorry, this user has been locked out.","tests","Wed May 14 00:40:48 UTC 2025","passed","Wed May 14 00:40:48 UTC 2025","","Регресс","",""
"","252","Юзер с ошибкой: Username is required","tests","Wed May 14 00:40:48 UTC 2025","passed","Wed May 14 00:40:49 UTC 2025","","Регресс","",""
"","1218","Успешный выход обычным юзером","tests","Wed May 14 00:40:49 UTC 2025","passed","Wed May 14 00:40:50 UTC 2025","","Регресс","",""
"","260","Юзер с ошибкой: Username and password do not match","tests","Wed May 14 00:40:48 UTC 2025","passed","Wed May 14 00:40:48 UTC 2025","","Регресс","",""
"","1227","Тест с ошибкой","tests","Wed May 14 00:40:50 UTC 2025","failed","Wed May 14 00:40:51 UTC 2025","","Регресс","",""
"","437","Успешный вход обычным юзером","tests","Wed May 14 00:40:47 UTC 2025","passed","Wed May 14 00:40:48 UTC 2025","","Регресс","",""
